,tweet_id,timestamp,text,rating_numerator,rating_denominator,name,doggo,floofer,pupper,puppo,favorite_count,retweet_count
234,836677758902222849,2017-02-28 20:41:37,Say hello to Oliver. He's pretty exotic. Fairly pupset as well. Too many midterms coming pup. 11/10 would pet with extreme caution https://t.co/fGAPAsxjKs,11,10,Oliver,0,0,0,0,12648.0,2231.0
235,836380477523124226,2017-02-28 01:00:19,"This is Ava. She just blasted off. Streamline af. Aerodynamic as h*ck. One small step for pupper, one giant leap for pupkind. 12/10 https://t.co/W4KffrdX3Q",12,10,Ava,0,0,1,0,14811.0,2996.0
236,836260088725786625,2017-02-27 17:01:56,This is Lucy. She spent all morning overseeing the shoveling of the driveway. H*ckin hard work. 13/10 very good girl Lucy https://t.co/gA2GECjiQD,13,10,Lucy,0,0,0,0,21376.0,4313.0
237,836001077879255040,2017-02-26 23:52:43,Atlas is back and this time he's prettier than the sunset. Seems to be aware of it too. 13/10 would give modeling contract https://t.co/uRdKlFArQE,13,10,,0,0,0,0,19153.0,4275.0
238,835574547218894849,2017-02-25 19:37:50,This is Eli. He works backstage at Bone Jovi concerts. Heavy duty earmuffs for puptection. H*ckin safe boy. 11/10 https://t.co/cVQEnUQd8q,11,10,Eli,0,0,0,0,17855.0,3635.0
239,835297930240217089,2017-02-25 01:18:40,Meet Ash. He's a Benebop Cumberplop. Quite rare. Fairly portable. Lil sandy tho. Clearly knows something you don't. 12/10 would hug softly https://t.co/1U0z6r5LSO,12,10,Ash,0,0,0,0,16538.0,3025.0
240,835264098648616962,2017-02-24 23:04:14,"Meet Lola. Her hobbies include being precious af and using her foot as a toothbrush. 12/10 Lola requests your help

https://t.co/FYFyHh7rir https://t.co/IiB7ggduoU",12,10,Lola,0,0,0,0,7767.0,1705.0
241,835172783151792128,2017-02-24 17:01:22,We only rate dogs. Please don't send in any non-canines like this Floppy Tongued House Panda. Thank you... 12/10 would still pet https://t.co/8fX2VkExnL,12,10,,0,0,0,0,26280.0,5790.0
242,834931633769889797,2017-02-24 01:03:08,This is Tucker. He decided it was time to part ways with his favorite ball. We captured the emotional farewell on camera. 12/10 https://t.co/jTe7Y6P0HK,12,10,Tucker,0,0,0,0,10851.0,1650.0
243,834786237630337024,2017-02-23 15:25:23,This is Tobi. She is properly fetching her shot. H*ckin nifty af bandana. 13/10 would send fully armed battalion to remind her of my love https://t.co/3FIqvumEXE,13,10,Tobi,0,0,0,0,21443.0,5522.0
244,834574053763584002,2017-02-23 01:22:14,Here's a doggo fully pupared for a shower. H*ckin exquisite balance. Sneaky tongue slip too. 13/10 https://t.co/UtEVnQ1ZPg,13,10,,1,0,0,0,13727.0,2551.0
245,834458053273591808,2017-02-22 17:41:18,"Meet Chester (bottom) &amp; Harold (top). They are different dogs not only in appearance, but in personality as well. Both 12/10 symbiotic af https://t.co/8ZOZS2FSJe",12,10,Chester,0,0,0,0,9669.0,1693.0
246,834209720923721728,2017-02-22 01:14:30,This is Wilson. He's aware that he has something on his face. Waiting for you to get it for him. 12/10 https://t.co/FaeinVjzTZ,12,10,Wilson,0,0,0,0,20706.0,4777.0
247,834167344700198914,2017-02-21 22:26:07,This is Sunshine. She doesn't believe in personal space. Eyes pretty far apart for a dog. Has horns (whoa). 11/10 would pet with wonder https://t.co/o3bhLguymB,11,10,Sunshine,0,0,0,0,15912.0,3682.0
248,834086379323871233,2017-02-21 17:04:24,This is Lipton. He's a West Romanian Snuggle Pup. Only a few left of his kind. 12/10 would boop https://t.co/5KmXPIGgAG,12,10,Lipton,0,0,0,0,13143.0,2220.0
249,833863086058651648,2017-02-21 02:17:06,This is Bentley. Hairbrushes are his favorite thing in the h*ckin world. 12/10 impawsible to say no to https://t.co/HDloTYilWZ,12,10,Bentley,0,0,0,0,13494.0,2420.0
250,833826103416520705,2017-02-20 23:50:09,Meet Charlie. She asked u to change the channel to Animal Planet at least 6 times. Now taking matters into her own paws. 13/10 assertive af https://t.co/WTzhtfevKY,13,10,Charlie,0,0,0,0,18154.0,3798.0
251,833722901757046785,2017-02-20 17:00:04,This is Bronte. She's fairly h*ckin aerodynamic. Also patiently waiting for mom to make her a main character. 13/10 would be an honor to pet https://t.co/w1MQWO2PET,13,10,Bronte,0,0,0,0,20913.0,3242.0
252,833479644947025920,2017-02-20 00:53:27,This is Poppy. She just arrived. 13/10 would snug passionately https://t.co/YGeSpyN8Gu,13,10,Poppy,0,0,0,0,14920.0,2063.0
253,833124694597443584,2017-02-19 01:23:00,This is Gidget. She's a spy pupper. Stealthy as h*ck. Must've slipped pup and got caught. 12/10 would forgive then pet https://t.co/zD97KYFaFa,12,10,Gidget,0,0,1,0,20331.0,4872.0
254,832998151111966721,2017-02-18 17:00:10,"This is Rhino. He arrived at a shelter with an elaborate doggo manual for his new family, written by someone who will always love him. 13/10 https://t.co/QX1h0oqMz0",13,10,Rhino,1,0,0,0,13348.0,2216.0
255,832757312314028032,2017-02-18 01:03:09,This is Willow. She's the official strawberry taste tester. Palate delicate af. Currently noting the subtle piquancy of this one. 13/10 https://t.co/On7muWnWSQ,13,10,Willow,0,0,0,0,16964.0,3654.0
256,832682457690300417,2017-02-17 20:05:43,Prosperous good boy 13/10 socioeconomic af https://t.co/8YlD5lxPbQ,13,10,,0,0,0,0,11957.0,2938.0
257,832636094638288896,2017-02-17 17:01:29,This is Orion. He just got back from the dentist. Cavity free af. 12/10 would give extra pats https://t.co/Y4DZx2UWsr,12,10,Orion,0,0,0,0,15949.0,2810.0
258,832397543355072512,2017-02-17 01:13:34,This is Eevee. She wants to see how you're doing. Just checkin pup on you. She hopes you're doing okay. 12/10 extremely good girl https://t.co/nqAJGCHKEt,12,10,Eevee,0,0,0,0,12036.0,2234.0
259,832369877331693569,2017-02-16 23:23:38,This is Charlie. He fell asleep on a heating vent. Would puppreciate your assistance. 11/10 someone help Charlie https://t.co/Dhdx5HnQ4d,11,10,Charlie,0,0,0,0,17289.0,3211.0
260,832273440279240704,2017-02-16 17:00:25,Say hello to Smiley. He's a blind therapy doggo having a h*ckin blast high steppin around in the snow. 14/10 would follow anywhere https://t.co/SHAb1wHjMz,14,10,Smiley,1,0,0,0,11427.0,2354.0
261,832032802820481025,2017-02-16 01:04:13,"This is Miguel. He was the only remaining doggo at the adoption center after the weekend. Let's change that. 12/10

https://t.co/P0bO8mCQwN https://t.co/SU4K34NT4M",12,10,Miguel,1,0,0,0,18001.0,4694.0
262,831939777352105988,2017-02-15 18:54:34,This is Emanuel. He's a h*ckin rare doggo. Dwells in a semi-urban environment. Round features make him extra collectible. 12/10 would so pet https://t.co/k9bzgyVdUT,12,10,Emanuel,1,0,0,0,24190.0,6184.0
263,831911600680497154,2017-02-15 17:02:36,Meet Kuyu. He was trapped in a well for 10 days. Rescued yesterday using a device designed by a local robotics team. 14/10 for all involved https://t.co/l38R6IZNNg,14,10,Kuyu,0,0,0,0,27810.0,6560.0
264,831670449226514432,2017-02-15 01:04:21,This is Daisy. She has a heart on her butt. 13/10 topical af https://t.co/u6p4LxzHKg,13,10,Daisy,0,0,0,0,10524.0,1839.0
265,831650051525054464,2017-02-14 23:43:18,"I usually only share these on Friday's, but this is Blue. He's a very smoochable pooch who needs your help. 13/10

https://t.co/piiX0ke8Z6 https://t.co/1UHrKcaCiO",13,10,,0,0,0,0,7204.0,1942.0
266,831552930092285952,2017-02-14 17:17:22,This is Dutch. He dressed up as his favorite emoji for Valentine's Day. I've got heart eyes for his heart eyes. 13/10 https://t.co/BCbmFYLrse,13,10,Dutch,0,0,0,0,9048.0,2331.0
267,831322785565769729,2017-02-14 02:02:51,This is Pete. He has no eyes. Needs a guide doggo. Also appears to be considerably fluffy af. 12/10 would hug softly https://t.co/Xc0gyovCtK,12,10,Pete,1,0,0,0,9341.0,1564.0
268,831315979191906304,2017-02-14 01:35:49,I couldn't make it to the #WKCDogShow BUT I have people there on the ground relaying me the finest pupper pics possible. 13/10 for all https://t.co/jd6lYhfdH4,13,10,,0,0,1,0,6592.0,1134.0
269,831309418084069378,2017-02-14 01:09:44,This is Scooter and his son Montoya.  Scooter is a wonderful father. He takes very good care of Montoya. Both 12/10 would pet at same time https://t.co/ghqMfxxa4V,12,10,Scooter,0,0,0,0,11847.0,2483.0
270,831262627380748289,2017-02-13 22:03:49,This is Tucker. He's feeling h*ckin festive and his owners don't have the heart to tell him Christmas is over. 12/10 https://t.co/zqR5XKMpuY,12,10,Tucker,0,0,0,0,12010.0,2065.0
271,830956169170665475,2017-02-13 01:46:03,Say hello to Reggie. He hates puns. 12/10 lighten pup Reggie https://t.co/X4vNEzAod5,12,10,Reggie,0,0,0,0,8043.0,1510.0
272,830583320585068544,2017-02-12 01:04:29,This is Lilly. She just parallel barked. Kindly requests a reward now. 13/10 would pet so well https://t.co/SATN4If5H5,13,10,Lilly,0,0,0,0,67396.0,16927.0
273,830097400375152640,2017-02-10 16:53:37,"Meet Samson. He's absolute fluffy perfection. Easily 13/10, but he needs your help. Click the link to find out more

https://t.co/z82hCtwhpn https://t.co/KoWrMkbMbW",13,10,Samson,0,0,0,0,9891.0,2976.0
274,829861396166877184,2017-02-10 01:15:49,This is Mia. She already knows she's a good dog. You don't have to tell her. 12/10 would probably tell her anyway https://t.co/xeudgDXmTU,12,10,Mia,0,0,0,0,12331.0,1968.0
275,829501995190984704,2017-02-09 01:27:41,This is Leo. He was a skater pup. She said see ya later pup. He wasn't good enough for her. 12/10 you're good enough for me Leo https://t.co/Xw9JbJHTul,12,10,Leo,0,0,0,0,32037.0,10700.0
276,829449946868879360,2017-02-08 22:00:52,Here's a stressed doggo. Had a long day. Many things on her mind. The hat communicates these feelings exquisitely. 11/10 https://t.co/fmRS43mWQB,11,10,,1,0,0,0,10546.0,2042.0
277,829374341691346946,2017-02-08 17:00:26,This is Astrid. She's a guide doggo in training. 13/10 would follow anywhere https://t.co/xo7FZFIAao,13,10,Astrid,1,0,0,0,,
278,829141528400556032,2017-02-08 01:35:19,This is Malcolm. He goes from sneaky tongue slip to flirt wink city in a matter of seconds. 12/10 would hug softly https://t.co/rHwfySggqR,12,10,Malcolm,0,0,0,0,24617.0,7432.0
279,829011960981237760,2017-02-07 17:00:28,This is Dexter. He was reunited with his mom yesterday after she was stuck in Iran during the travel Bannon. 13/10 welcome home https://t.co/U50RlRw4is,13,10,Dexter,0,0,0,0,53569.0,16459.0
280,828770345708580865,2017-02-07 01:00:22,This is Alfie. He's your Lyft for tonight. Kindly requests you buckle pup and remain reasonably calm during the ride. 13/10 he must focus https://t.co/AqPTHYUBFz,13,10,Alfie,0,0,0,0,25824.0,5929.0
281,828650029636317184,2017-02-06 17:02:17,"Occasionally, we're sent fantastic stories. This is one of them. 14/10 for Grace https://t.co/bZ4axuH6OK",14,10,,0,0,0,0,9596.0,1364.0
282,828409743546925057,2017-02-06 01:07:28,This is Mutt Ryan. He's quite confident at the moment. 12/10 rise pup! https://t.co/ZH5CvRlCxt,12,10,Mutt,0,0,0,0,6408.0,1176.0
283,828408677031882754,2017-02-06 01:03:14,This is Bear. He went outside to play in the snow. Needed a break from the game. Feeling a tad better now. 12/10  deep breaths Bear https://t.co/7WFLKli2T3,12,10,Bear,0,0,0,0,7746.0,1304.0
284,828381636999917570,2017-02-05 23:15:47,Meet Doobert. He's a deaf doggo. Didn't stop him on the field tho. Absolute legend today. 14/10 would pat head approvingly https://t.co/iCk7zstRA9,14,10,Doobert,1,0,0,0,12703.0,2234.0
285,828376505180889089,2017-02-05 22:55:23,"This is Beebop. Her name means ""Good Dog"" in robot. She also was a star on the field today. 13/10 would pet well https://t.co/HKBVZqXFNR",13,10,Beebop,0,0,0,0,7451.0,1082.0
286,828372645993398273,2017-02-05 22:40:03,This is Alexander Hamilpup. He was one of the many stars in this year's Puppy Bowl. He just hopes both teams had fun. 12/10 https://t.co/JcTuUcyYNS,12,10,Alexander,0,0,0,0,12674.0,2972.0
287,828361771580813312,2017-02-05 21:56:51,Beebop and Doobert should start a band 12/10 would listen,12,10,,0,0,0,0,2217.0,173.0
288,828046555563323392,2017-02-05 01:04:17,This is Sailer. He waits on the roof for his owners to come home. Nobody knows how he gets up there. H*ckin loyal af. 13/10 https://t.co/O37z4jaMG9,13,10,Sailer,0,0,0,0,11871.0,2903.0
289,828011680017821696,2017-02-04 22:45:42,Say hello to Brutus and Jersey. They think they're the same size. Best furiends furever. Both 11/10 would pet simultaneously https://t.co/rkhCFfDtxB,11,10,Brutus,0,0,0,0,10449.0,2169.0
290,827933404142436356,2017-02-04 17:34:40,This is Kona. Yesterday she stopped by the department to see what it takes to be a police pupper. 12/10 vest was only a smidge too big https://t.co/j8D3PQJvpJ,12,10,Kona,0,0,1,0,20308.0,5307.0
291,827653905312006145,2017-02-03 23:04:02,This is Boots. She doesn't know what to do with treats so she just holds them. Very good girl. 12/10 would give more treats https://t.co/eAA8lratd3,12,10,Boots,0,0,0,0,15639.0,3049.0
292,827600520311402496,2017-02-03 19:31:54,Meet Tucker. It's his birthday. He's pupset with you because you're too busy playing @GoodDogsGame to celebrate. 13/10 would put down phone https://t.co/vrppizPGdb,13,10,Tucker,0,0,0,0,7514.0,954.0
293,827324948884643840,2017-02-03 01:16:53,"This is Ralphie. He's being treated for an overactive funny bone, which is no joke. 12/10 would try to pet with a straight face https://t.co/UU3KqQF5n5",12,10,Ralphie,0,0,0,0,16017.0,3092.0
294,827199976799354881,2017-02-02 17:00:17,This is Charlie. He wins every game of chess he plays. Won't let opponent pet him until they forfeit. 13/10 you win again Charlie https://t.co/UkyQibIBzZ,13,10,Charlie,0,0,0,0,10687.0,2247.0
295,826958653328592898,2017-02-02 01:01:21,This is Loki. He smiles like Elvis. Ain't nothin but a hound doggo. 12/10 https://t.co/QV5nx6otZR,12,10,Loki,1,0,0,0,21801.0,5070.0
296,826848821049180160,2017-02-01 17:44:55,This is Cupid. He was found in the trash. Now he's well on his way to prosthetic front legs and a long happy doggo life. 13/10 heroic af https://t.co/WS0Gha8vRh,13,10,Cupid,1,0,0,0,36743.0,10300.0
297,826598365270007810,2017-02-01 01:09:42,This is Pawnd... James Pawnd. He's suave af. 13/10 would trust with my life https://t.co/YprN62Z74I,13,10,Pawnd,0,0,0,0,10146.0,2371.0
298,826476773533745153,2017-01-31 17:06:32,This is Pilot. He has mastered the synchronized head tilt and sneaky tongue slip. Usually not unlocked until later doggo days. 12/10 https://t.co/YIV8sw8xkh,12,10,Pilot,1,0,0,0,18617.0,4244.0
299,826240494070030336,2017-01-31 01:27:39,We only rate dogs. Please don't send in any more non-dogs like this Wild Albanian Street Moose. Thank you... 11/10 https://t.co/srXL2s868C,11,10,,0,0,0,0,13453.0,2640.0
300,826204788643753985,2017-01-30 23:05:46,"Here's a little more info on Dew, your favorite roaming doggo that went h*ckin viral. 13/10 
https://t.co/1httNYrCeW https://t.co/KvaM8j3jhX",13,10,,1,0,0,0,4930.0,936.0
301,826115272272650244,2017-01-30 17:10:04,This is Ike. He's demonstrating the pupmost restraint. 13/10 super good boy https://t.co/6gHoGah9nm,13,10,Ike,0,0,0,0,15832.0,3176.0
302,825876512159186944,2017-01-30 01:21:19,This is Mo. No one will push him around in the grocery cart. He's quite pupset about it. 11/10 I volunteer https://t.co/feNwTq12S5,11,10,Mo,0,0,0,0,10597.0,1898.0
303,825829644528148480,2017-01-29 22:15:05,This is Toby. He just found out you only pretend to throw the ball sometimes. H*ckin puppalled. 12/10 would console https://t.co/YimNdkZrhM,12,10,Toby,0,0,0,0,12871.0,2521.0
304,825535076884762624,2017-01-29 02:44:34,Here's a very loving and accepting puppo. Appears to have read her Constitution well. 14/10 would pat head approvingly https://t.co/6ao80wIpV1,14,10,,0,0,0,1,57438.0,17743.0
305,825147591692263424,2017-01-28 01:04:51,This is Sweet Pea. She hides in shoe boxes and waits for someone to pick her. Then she surpuprises them. 13/10 https://t.co/AyBEmx56MD,13,10,Sweet,0,0,0,0,18529.0,4603.0
306,825026590719483904,2017-01-27 17:04:02,"Say hello to Pablo. He's one gorgeous puppo. A true 12/10. Click the link to see why Pablo requests your assistance

https://t.co/koHvVQp9bL https://t.co/IhW0JKf7kc",12,10,Pablo,0,0,0,1,6381.0,1279.0
307,824775126675836928,2017-01-27 00:24:48,This is Scooter. His lack of opposable thumbs is rendering his resistance to tickling embarrassingly moot. 12/10 would keep tickling https://t.co/F0VWg2GztI,12,10,Scooter,0,0,0,0,15122.0,3568.0
308,824663926340194305,2017-01-26 17:02:56,This is Wilson. Named after the volleyball. He tongue wrestled a bee and lost. 13/10 valiant effort tho https://t.co/A5Mx4h1FSM,13,10,Wilson,0,0,0,0,10219.0,1767.0
309,824325613288833024,2017-01-25 18:38:36,Retweet the h*ck out of this 13/10 pupper #BellLetsTalk https://t.co/wBmc7OaGvS,13,10,,0,0,1,0,11964.0,10656.0
310,824297048279236611,2017-01-25 16:45:05,This is Nala. She got in trouble. One h*ck of a pupnishment. Still 11/10 would pet https://t.co/EmJbG0skLt,11,10,Nala,0,0,0,0,15246.0,3920.0
311,824025158776213504,2017-01-24 22:44:42,"""I wish we were dogs"" 14/10 for @BadlandsNPS https://t.co/50qq2DItPW",14,10,,0,0,0,0,4885.0,605.0
312,823939628516474880,2017-01-24 17:04:50,This is Cash. He's officially given pup on today. 12/10 frighteningly relatable https://t.co/m0hrATIEyw,12,10,Cash,0,0,0,0,10754.0,2748.0
313,823699002998870016,2017-01-24 01:08:40,This is Winston. The goggles make him a superhero. Protects the entire city from criminals unless they rub his belly really well. 12/10 https://t.co/yCydYURYEL,12,10,Winston,0,0,0,0,14166.0,2553.0
314,823581115634085888,2017-01-23 17:20:14,This is Crawford. He's quite h*ckin good at the selfies. Nose is incredibly boopable. 11/10 would snapchat https://t.co/6F5Rrp472U,11,10,Crawford,0,0,0,0,13199.0,2663.0
315,823322678127919110,2017-01-23 00:13:17,This is Wyatt. He's got the fastest paws in the West. H*ckin deadly. 11/10 would ride into the sunset with https://t.co/stkJ377KK7,11,10,Wyatt,0,0,0,0,15934.0,4089.0
316,822975315408461824,2017-01-22 01:12:59,This is Albus. He's soaked as h*ck. Seems to have misplaced an ear as well. Still in good spirits tho. 12/10 would dry https://t.co/yUM8jYStuG,12,10,Albus,0,0,0,0,17526.0,3501.0
317,822872901745569793,2017-01-21 18:26:02,Here's a super supportive puppo participating in the Toronto  #WomensMarch today. 13/10 https://t.co/nTz3FtorBc,13,10,,0,0,0,1,133307.0,43930.0
318,822859134160621569,2017-01-21 17:31:20,This is Hobbes. He was told he was going to the park. Ended up at the vet. H*ckin bamboozled. Quite pupset with you. 12/10 https://t.co/SSQE06XClS,12,10,Hobbes,0,0,0,0,13461.0,2321.0
319,822610361945911296,2017-01-21 01:02:48,Please stop sending in non-canines like this Very Pettable Dozing Bath Tortoise. We only rate dogs. Only send dogs... 12/10 https://t.co/mcagPeENIh,12,10,,0,0,0,0,15028.0,3002.0
320,822489057087389700,2017-01-20 17:00:46,This is Paisley. She really wanted to be president this time. Dreams officially crushed. 13/10 https://t.co/liJGwMp17E,13,10,Paisley,0,0,0,0,18397.0,6505.0
321,822462944365645825,2017-01-20 15:17:01,"This is Gabe. He was the unequivocal embodiment of a dream meme, but also one h*ck of a pupper. You will be missed by so many. 14/10 RIP https://t.co/M3hZGadUuO",14,10,Gabe,0,0,1,0,28445.0,14562.0
322,822244816520155136,2017-01-20 00:50:15,We only rate dogs. Please don't send pics of men capturing low level clouds. Thank you... 11/10 https://t.co/rLi83ZyCL5,11,10,,0,0,0,0,35439.0,10042.0
323,821886076407029760,2017-01-19 01:04:45,This is Jimison. He was just called a good boy. 13/10 https://t.co/djMep7mGkV,13,10,Jimison,0,0,0,0,11474.0,2351.0
324,821765923262631936,2017-01-18 17:07:18,This is Duchess. She uses dark doggo forces to levitate her toys. 13/10 magical af https://t.co/maDNMETA52,13,10,Duchess,1,0,0,0,8535.0,1682.0
325,821522889702862852,2017-01-18 01:01:34,This is Harlso. He has a really good idea but isn't sure you're going to like it. 13/10 he'll just keep it to himself https://t.co/IzcaR3Nqyn,13,10,Harlso,0,0,0,0,8148.0,1796.0
326,821407182352777218,2017-01-17 17:21:47,This is Sundance. He's a doggo drummer. Even sings a bit on the side. 14/10 entertained af (vid by @sweetsundance) https://t.co/Xn5AQtiqzG,14,10,Sundance,1,0,0,0,11951.0,4415.0
327,821149554670182400,2017-01-17 00:18:04,This is Luca. He got caught howling. H*ckin embarrassed. 12/10 https://t.co/r8DxA8DYJ2,12,10,Luca,0,0,0,0,8780.0,2026.0
328,821107785811234820,2017-01-16 21:32:06,Here's a doggo who looks like he's about to give you a list of mythical ingredients to go collect for his potion. 11/10 would obey https://t.co/8SiwKDlRcl,11,10,,1,0,0,0,9739.0,2172.0
329,821044531881721856,2017-01-16 17:20:45,This is Flash. He went way too hard celebrating Martin Luther King Day last night. 12/10 now he's having a dream in his honor https://t.co/bryVdNaRcu,12,10,Flash,0,0,0,0,12843.0,2320.0
330,820749716845686786,2017-01-15 21:49:15,Meet Sunny. He can take down a polar bear in one fell swoop. Fr*cken deadly af. 13/10 would pet with caution https://t.co/EMq8Ud6Ze1,13,10,Sunny,0,0,0,0,32033.0,10066.0
331,820314633777061888,2017-01-14 17:00:24,"We are proud to support @LoveYourMelon on their mission to put a hat on every kid battling cancer. They are 14/10

https://t.co/XQlmPTLHPl https://t.co/ZNIkkHgtYE",14,10,,0,0,0,0,3394.0,572.0
332,820078625395449857,2017-01-14 01:22:35,I've never wanted to go to a camp more in my entire life. 12/10 for all on board https://t.co/wJZlpGFEbD,12,10,,0,0,0,0,20121.0,6403.0
333,819952236453363712,2017-01-13 17:00:21,"This is Oliver. He has dreams of being a service puppo so he can help his owner. 13/10 selfless af

make it happen:
https://t.co/f5WMsx0a9K https://t.co/6lJz0DKZIb",13,10,Oliver,0,0,0,1,5409.0,1198.0
334,819924195358416896,2017-01-13 15:08:56,Here we have a doggo who has messed up. He was hoping you wouldn't notice. 11/10 someone help him https://t.co/XdRNXNYD4E,11,10,,1,0,0,0,13092.0,4954.0
335,819711362133872643,2017-01-13 01:03:12,This is Howie. He just bloomed. 11/10 revolutionary af https://t.co/m5fYxrO3IU,11,10,Howie,0,0,0,0,13601.0,3169.0
336,819588359383371776,2017-01-12 16:54:26,This is Jazzy. She just found out that sandwich wasn't for her. Shocked and puppalled. 13/10 deep breaths Jazzy https://t.co/52cItP0vIO,13,10,Jazzy,0,0,0,0,9791.0,2022.0
337,819347104292290561,2017-01-12 00:55:47,Say hello to Anna and Elsa. They fall asleep in similar positions. It's pretty wild. Both 12/10 would snug simultaneously https://t.co/8rUL99bX4W,12,10,Anna,0,0,0,0,7328.0,1230.0
338,819227688460238848,2017-01-11 17:01:16,This is Finn. He's wondering if you come here often. Fr*ckin flirtatious af. 12/10 would give number to https://t.co/ii5eNX5LJT,12,10,Finn,0,0,0,0,23440.0,6852.0
339,819006400881917954,2017-01-11 02:21:57,This is Sunny. She was also a very good First Doggo. 14/10 would also be an absolute honor to pet https://t.co/YOC1fHFCSb,14,10,Sunny,1,0,0,0,45976.0,19288.0
340,819004803107983360,2017-01-11 02:15:36,This is Bo. He was a very good First Doggo. 14/10 would be an absolute honor to pet https://t.co/AdPKrI8BZ1,14,10,Bo,1,0,0,0,88226.0,37500.0
341,818627210458333184,2017-01-10 01:15:10,Meet Wafer. He represents every fiber of my being. 13/10 very good dog https://t.co/I7bkhxBxUG,13,10,Wafer,0,0,0,0,22778.0,7676.0
342,818614493328580609,2017-01-10 00:24:38,This is Bear. He's a passionate believer of the outdoors. Leaves excite him. 12/10 would hug softly https://t.co/FOF0hBDxP8,12,10,Bear,0,0,0,0,10003.0,2612.0
343,818536468981415936,2017-01-09 19:14:36,This is Tom. He's a silly dog. Known for his unconventional swing style. One h*ck of a sneaky tongue slip too. 11/10 would push https://t.co/6fSVcn9HAU,11,10,Tom,0,0,0,0,11082.0,2508.0
344,818259473185828864,2017-01-09 00:53:55,This is Florence. He saw the same snap you sent him on your story. Pretty pupset with you. 12/10 https://t.co/rnkvT2kvib,12,10,Florence,0,0,0,0,11209.0,2312.0
345,818145370475810820,2017-01-08 17:20:31,This is Autumn. Her favorite toy is a cheeseburger. She takes it everywhere. 11/10 https://t.co/JlPug12E5Z,11,10,Autumn,0,0,0,0,12500.0,2618.0
346,817908911860748288,2017-01-08 01:40:55,"Looks like he went cross-eyed trying way too hard to use the force. 12/10 
https://t.co/bbuKxk0fM8",12,10,,0,0,0,0,4942.0,818.0
347,817827839487737858,2017-01-07 20:18:46,This is Buddy. He ran into a glass door once. Now he's h*ckin skeptical. 13/10 empowering af (vid by Brittany Gaunt) https://t.co/q2BgNIi3OA,13,10,Buddy,0,0,0,0,52568.0,27566.0
348,817777686764523521,2017-01-07 16:59:28,"This is Dido. She's playing the lead role in ""Pupper Stops to Catch Snow Before Resuming Shadow Box with Dried Apple."" 13/10 (IG: didodoggo) https://t.co/m7isZrOBX7",13,10,Dido,1,0,1,0,10914.0,2744.0
349,817536400337801217,2017-01-07 01:00:41,"Say hello to Eugene &amp; Patti Melt. No matter how dysfunctional they get, they will never top their owners. Both 12/10 would pet at same time https://t.co/jQUdvtdYMu",12,10,Eugene,0,0,0,0,11966.0,3026.0
350,817423860136083457,2017-01-06 17:33:29,This is Ken. His cheeks are magic. 13/10 (IG: ken_shiba) https://t.co/btzf1zTDeQ,13,10,Ken,0,0,0,0,34437.0,15023.0
351,817415592588222464,2017-01-06 17:00:38,"Meet Strudel. He's rather h*ckin pupset that your clothes clash. 11/10 click the link to see how u can help Strudel

https://t.co/3uxgLz8d0l https://t.co/O0ECL1StB2",11,10,Strudel,0,0,0,0,5698.0,972.0
352,817171292965273600,2017-01-06 00:49:53,This is Tebow. He kindly requests that you put down the coffee and play with him. 13/10 such a good boy https://t.co/56uBP28eqw,13,10,Tebow,0,0,0,0,8921.0,2062.0
353,817120970343411712,2017-01-05 21:29:55,Name a more iconic quartet... I'll wait. 13/10 for all https://t.co/kCLgD8687T,13,10,,0,0,0,0,12418.0,2650.0
354,817056546584727552,2017-01-05 17:13:55,This is Chloe. She fell asleep at the wheel. Absolute menace on the roadways. Sneaky tongue slip tho. 11/10 https://t.co/r6SLVN2VUH,11,10,Chloe,0,0,0,0,8742.0,1677.0
355,816816676327063552,2017-01-05 01:20:46,This is Timber. He misses Christmas. Specifically the presents part. 12/10 cheer pup Timber https://t.co/dVVavqpeF9,12,10,Timber,0,0,0,0,10197.0,2077.0
