,tweet_id,timestamp,text,rating_numerator,rating_denominator,name,doggo,floofer,pupper,puppo,favorite_count,retweet_count
0,892420643555336193,2017-08-01 16:23:56,This is Phineas. He's a mystical boy. Only ever appears in the hole of a donut. 13/10 https://t.co/MgUWQ76dJU,13,10,Phineas,0,0,0,0,36274.0,7725.0
1,892177421306343426,2017-08-01 00:17:27,"This is Tilly. She's just checking pup on you. Hopes you're doing ok. If not, she's available for pats, snugs, boops, the whole bit. 13/10 https://t.co/0Xxu71qeIV",13,10,Tilly,0,0,0,0,31279.0,5709.0
2,891815181378084864,2017-07-31 00:18:03,This is Archie. He is a rare Norwegian Pouncing Corgo. Lives in the tall grass. You never know when one may strike. 12/10 https://t.co/wUnZnhtVJB,12,10,Archie,0,0,0,0,23546.0,3783.0
3,891689557279858688,2017-07-30 15:58:51,This is Darla. She commenced a snooze mid meal. 13/10 happens to the best of us https://t.co/tD36da7qLQ,13,10,Darla,0,0,0,0,39566.0,7878.0
4,891327558926688256,2017-07-29 16:00:24,"This is Franklin. He would like you to stop calling him ""cute."" He is a very fierce shark and should be respected as such. 12/10 #BarkWeek https://t.co/AtUZn91f7f",12,10,Franklin,0,0,0,0,37789.0,8495.0
5,891087950875897856,2017-07-29 00:08:17,Here we have a majestic great white breaching off South Africa's coast. Absolutely h*ckin breathtaking. 13/10 (IG: tucker_marlo) #BarkWeek https://t.co/kQ04fDDRmh,13,10,,0,0,0,0,19033.0,2845.0
6,890971913173991426,2017-07-28 16:27:12,"Meet Jax. He enjoys ice cream so much he gets nervous around it. 13/10 help Jax enjoy more things by clicking below

https://t.co/Zr4hWfAs1H https://t.co/tVJBRMnhxl",13,10,Jax,0,0,0,0,11081.0,1854.0
7,890729181411237888,2017-07-28 00:22:40,When you watch your owner call another dog a good boy but then they turn back to you and say you're a great boy. 13/10 https://t.co/v0nONBcwxq,13,10,,0,0,0,0,61121.0,17231.0
8,890609185150312448,2017-07-27 16:25:51,This is Zoey. She doesn't want to be one of the scary sharks. Just wants to be a snuggly pettable boatpet. 13/10 #BarkWeek https://t.co/9TwLuAGH0b,13,10,Zoey,0,0,0,0,26189.0,3919.0
9,890240255349198849,2017-07-26 15:59:51,This is Cassie. She is a college pup. Studying international doggo communication and stick theory. 14/10 so elegant much sophisticate https://t.co/t1bfwz5S2A,14,10,Cassie,1,0,0,0,29929.0,6706.0
10,890006608113172480,2017-07-26 00:31:25,This is Koda. He is a South Australian deckshark. Deceptively deadly. Frighteningly majestic. 13/10 would risk a petting #BarkWeek https://t.co/dVPW0B0Mme,13,10,Koda,0,0,0,0,28808.0,6697.0
11,889880896479866881,2017-07-25 16:11:53,This is Bruno. He is a service shark. Only gets out of the water to assist you. 13/10 terrifyingly good boy https://t.co/u1XPQMl29g,13,10,Bruno,0,0,0,0,26213.0,4559.0
12,889665388333682689,2017-07-25 01:55:32,Here's a puppo that seems to be on the fence about something haha no but seriously someone help her. 13/10 https://t.co/BxvuXk0UCm,13,10,,0,0,0,1,45129.0,9146.0
13,889638837579907072,2017-07-25 00:10:02,This is Ted. He does his best. Sometimes that's not enough. But it's ok. 12/10 would assist https://t.co/f8dEDcrKSR,12,10,Ted,0,0,0,0,25404.0,4100.0
14,889531135344209921,2017-07-24 17:02:04,This is Stuart. He's sporting his favorite fanny pack. Secretly filled with bones only. 13/10 puppared puppo #BarkWeek https://t.co/y70o6h3isq,13,10,Stuart,0,0,0,1,14206.0,2060.0
15,889278841981685760,2017-07-24 00:19:32,This is Oliver. You're witnessing one of his many brutal attacks. Seems to be playing with his victim. 13/10 fr*ckin frightening #BarkWeek https://t.co/WpHvrQedPb,13,10,Oliver,0,0,0,0,23660.0,4868.0
16,888917238123831296,2017-07-23 00:22:39,This is Jim. He found a fren. Taught him how to sit like the good boys. 12/10 for both https://t.co/chxruIOUJN,12,10,Jim,0,0,0,0,27343.0,4111.0
17,888804989199671297,2017-07-22 16:56:37,This is Zeke. He has a new stick. Very proud of it. Would like you to throw it for him without taking it. 13/10 would do my best https://t.co/HTQ77yNQ5K,13,10,Zeke,0,0,0,0,24030.0,3877.0
18,888554962724278272,2017-07-22 00:23:06,This is Ralphus. He's powering up. Attempting maximum borkdrive. 13/10 inspirational af https://t.co/YnYAFCTTiK,13,10,Ralphus,0,0,0,0,18551.0,3181.0
19,888078434458587136,2017-07-20 16:49:33,This is Gerald. He was just told he didn't get the job he interviewed for. A h*ckin injustice. 12/10 didn't want the job anyway https://t.co/DK7iDPfuRX,12,10,Gerald,0,0,0,0,20458.0,3164.0
20,887705289381826560,2017-07-19 16:06:48,This is Jeffrey. He has a monopoly on the pool noodles. Currently running a 'boop for two' midweek sale. 13/10 h*ckin strategic https://t.co/PhrUk20Q64,13,10,Jeffrey,0,0,0,0,28404.0,4916.0
21,887517139158093824,2017-07-19 03:39:09,I've yet to rate a Venezuelan Hover Wiener. This is such an honor. 14/10 paw-inspiring af (IG: roxy.thedoxy) https://t.co/20VrLAA8ba,14,10,,0,0,0,0,43592.0,10760.0
22,887473957103951883,2017-07-19 00:47:34,This is Canela. She attempted some fancy porch pics. They were unsuccessful. 13/10 someone help her https://t.co/cLyzpcUcMX,13,10,Canela,0,0,0,0,64597.0,16444.0
23,887343217045368832,2017-07-18 16:08:03,You may not have known you needed to see this today. 13/10 please enjoy (IG: emmylouroo) https://t.co/WZqNqygEyV,13,10,,0,0,0,0,31616.0,9564.0
24,887101392804085760,2017-07-18 00:07:08,This... is a Jubilant Antarctic House Bear. We only rate dogs. Please only send dogs. Thank you... 12/10 would suffocate in floof https://t.co/4Ad1jzJSdp,12,10,,0,0,0,0,28773.0,5447.0
25,886983233522544640,2017-07-17 16:17:36,This is Maya. She's very shy. Rarely leaves her cup. 13/10 would find her an environment to thrive in https://t.co/I6oNy0CgiT,13,10,Maya,0,0,0,0,32820.0,7013.0
26,886736880519319552,2017-07-16 23:58:41,"This is Mingus. He's a wonderful father to his smol pup. Confirmed 13/10, but he needs your help

https://t.co/bVi0Yr4Cff https://t.co/ISvKOSkd5b",13,10,Mingus,0,0,0,0,11260.0,2936.0
27,886680336477933568,2017-07-16 20:14:00,This is Derek. He's late for a dog meeting. 13/10 pet...al to the metal https://t.co/BCoWue0abA,13,10,Derek,0,0,0,0,21115.0,4085.0
28,886366144734445568,2017-07-15 23:25:31,This is Roscoe. Another pupper fallen victim to spontaneous tongue ejections. Get the BlepiPen immediate. 12/10 deep breaths Roscoe https://t.co/RGE08MIJox,12,10,Roscoe,0,0,1,0,19865.0,2893.0
29,886258384151887873,2017-07-15 16:17:19,This is Waffles. His doggles are pupside down. Unsure how to fix. 13/10 someone assist Waffles https://t.co/xZDA9Qsq1O,13,10,Waffles,0,0,0,0,26307.0,5768.0
30,885984800019947520,2017-07-14 22:10:11,Viewer discretion advised. This is Jimbo. He will rip ur finger right h*ckin off. Other dog clearly an accessory. 12/10 pls pet with caution https://t.co/BuveP0uMF1,12,10,Jimbo,0,0,0,0,30592.0,6138.0
31,885528943205470208,2017-07-13 15:58:47,This is Maisey. She fell asleep mid-excavation. Happens to the best of us. 13/10 would pat noggin approvingly https://t.co/tp1kQ8i9JF,13,10,Maisey,0,0,0,0,33767.0,5840.0
32,885518971528720385,2017-07-13 15:19:09,I have a new hero and his name is Howard. 14/10 https://t.co/gzLHboL7Sk,14,10,,0,0,0,0,19244.0,3407.0
33,885167619883638784,2017-07-12 16:03:00,Here we have a corgi undercover as a malamute. Pawbably doing important investigative work. Zero control over tongue happenings. 13/10 https://t.co/44ItaMubBf,13,10,,0,0,0,0,20571.0,3996.0
34,884925521741709313,2017-07-12 00:01:00,"This is Earl. He found a hat. Nervous about what you think of it. 12/10 it's delightful, Earl https://t.co/MYJvdlNRVa",12,10,Earl,0,0,0,0,72475.0,16540.0
35,884876753390489601,2017-07-11 20:47:12,This is Lola. It's her first time outside. Must test the earth and taste the atmosphere. 13/10 you're doing great Lola https://t.co/74TKAUsLkO,13,10,Lola,0,0,0,0,26177.0,5104.0
36,884562892145688576,2017-07-11 00:00:02,This is Kevin. He's just so happy. 13/10 what is your secret Kevin https://t.co/1r4MFCbCX5,13,10,Kevin,0,0,0,0,22820.0,4298.0
37,884441805382717440,2017-07-10 15:58:53,"I present to you, Pup in Hat. Pup in Hat is great for all occasions. Extremely versatile. Compact as h*ck. 14/10 (IG: itselizabethgales) https://t.co/vvBOcC2VdC",14,10,,0,0,0,0,25448.0,5206.0
38,884247878851493888,2017-07-10 03:08:17,OMG HE DIDN'T MEAN TO HE WAS JUST TRYING A LITTLE BARKOUR HE'S SUPER SORRY 13/10 WOULD FORGIVE IMMEDIATE https://t.co/uF3pQ8Wubj,13,10,,0,0,0,0,68210.0,18579.0
39,884162670584377345,2017-07-09 21:29:42,Meet Yogi. He doesn't have any important dog meetings today he just enjoys looking his best at all times. 12/10 for dangerously dapper doggo https://t.co/YSI00BzTBZ,12,10,Yogi,1,0,0,0,19171.0,2738.0
40,883838122936631299,2017-07-09 00:00:04,This is Noah. He can't believe someone made this mess. Got the vacuum out for you though. Offered to help clean pup. 12/10 super good boy https://t.co/V85xujjDDY,12,10,Noah,0,0,0,0,20543.0,3142.0
41,883360690899218434,2017-07-07 16:22:55,Meet Grizzwald. He may be the floofiest floofer I ever did see. Lost eyes saving a schoolbus from a volcano erpuption. 13/10 heroic as h*ck https://t.co/rf661IFEYP,13,10,Grizzwald,0,1,0,0,21307.0,3384.0
42,883117836046086144,2017-07-07 00:17:54,"Please only send dogs. We don't rate mechanics, no matter how h*ckin good. Thank you... 13/10 would sneak a pat https://t.co/Se5fZ9wp5E",13,10,,0,0,0,0,34848.0,6068.0
43,882992080364220416,2017-07-06 15:58:11,This is Rusty. He wasn't ready for the first pic. Clearly puppared for the second. 13/10 confirmed great boy https://t.co/tyER0KpdXj,13,10,Rusty,0,0,0,0,22439.0,3561.0
44,882762694511734784,2017-07-06 00:46:41,This is Gus. He's quite the cheeky pupper. Already perfected the disinterested wink. 12/10 would let steal my girl https://t.co/D43I96SlVu,12,10,Gus,0,0,1,0,26563.0,4474.0
45,882627270321602560,2017-07-05 15:48:34,This is Stanley. He has his first swim lesson today. Doggle straps adjusted. Ready to go. 13/10 Phelps is nervous (IG: stanleythe_corgi) https://t.co/Nx52PGwH94,13,10,Stanley,0,0,0,0,26305.0,5557.0
46,882268110199369728,2017-07-04 16:01:23,This is Alfy. You're witnessing his first watermelon experience. I think it was a success. 13/10 happy 4th Alfy ðŸ‡ºðŸ‡¸ https://t.co/fYP5RlutfA,13,10,Alfy,0,0,0,0,42130.0,10579.0
47,882045870035918850,2017-07-04 01:18:17,"This is Koko. Her owner, inspired by Barney, recently built a cart for her to use during walks if she got tired. 13/10 rest easy Koko https://t.co/zeDpnsKX7w",13,10,Koko,0,0,0,0,27541.0,4469.0
48,881906580714921986,2017-07-03 16:04:48,This is Rey. He's a Benebop Cumberfloof. 12/10 dangerously pettable https://t.co/503CgWbhxQ,12,10,Rey,0,0,0,0,22861.0,3110.0
49,881666595344535552,2017-07-03 00:11:11,This is Gary. He couldn't miss this puppertunity for a selfie. Flawless focusing skills. 13/10 would boop intensely https://t.co/7CSWCl8I6s,13,10,Gary,0,0,0,0,47595.0,9766.0
50,881536004380872706,2017-07-02 15:32:16,"Here is a pupper approaching maximum borkdrive. Zooming at never before seen speeds. 14/10 paw-inspiring af 
(IG: puffie_the_chow) https://t.co/ghXBIIeQZF",14,10,,0,0,1,0,46485.0,14600.0
51,881268444196462592,2017-07-01 21:49:04,Meet Elliot. He's a Canadian Forrest Pup. Unusual number of antlers for a dog. Sneaky tongue slip to celebrate #Canada150. 12/10 would pet https://t.co/cgwJwowTMC,12,10,Elliot,0,0,0,0,21839.0,4821.0
52,880935762899988482,2017-06-30 23:47:07,This is Louis. He's crossing. It's a big deal. 13/10 h*ckin breathtaking https://t.co/D0wb1GlKAt,13,10,Louis,0,0,0,0,16047.0,2552.0
53,880872448815771648,2017-06-30 19:35:32,Ugh not again. We only rate dogs. Please don't send in well-dressed  floppy-tongued street penguins. Dogs only please. Thank you... 12/10 https://t.co/WiAMbTkDPf,12,10,,0,0,0,0,20009.0,3503.0
54,880465832366813184,2017-06-29 16:39:47,This is Bella. She had her first beach experience this morning. Complete success. 12/10 would perform a sandy boop https://t.co/4VsFysDmiw,12,10,Bella,0,0,0,0,26782.0,5689.0
55,880221127280381952,2017-06-29 00:27:25,Meet Jesse. He's a Fetty Woof. His tongue ejects without warning. A true bleptomaniac. 12/10 would snug well https://t.co/fUod0tVmvK,12,10,Jesse,0,0,0,0,25349.0,3812.0
56,880095782870896641,2017-06-28 16:09:20,Please don't send in photos without dogs in them. We're not @porch_rates. Insubordinate and churlish. Pretty good porch tho 11/10 https://t.co/HauE8M3Bu4,11,10,,0,0,0,0,25963.0,3972.0
57,879862464715927552,2017-06-28 00:42:13,This is Romeo. He would like to do an entrance. Requesting your immediate assistance. 13/10 https://t.co/Qh5aEkRQm9,13,10,Romeo,0,0,0,0,21035.0,3203.0
58,879492040517615616,2017-06-27 00:10:17,This is Bailey. He thinks you should measure ear length for signs of growth instead. 12/10 https://t.co/IxM9IMKQq8,12,10,Bailey,0,0,0,0,22076.0,2915.0
59,879415818425184262,2017-06-26 19:07:24,This is Duddles. He did an attempt. 13/10 someone help him (vid by Georgia Felici) https://t.co/UDT7ZkcTgY,13,10,Duddles,0,0,0,0,99429.0,40670.0
60,879376492567855104,2017-06-26 16:31:08,This is Jack AKA Stephen Furry. You're not scoring on him. Unless he slips down the slide. 12/10 would happily get blocked by https://t.co/0gOi601EAa,12,10,Jack,0,0,0,0,15798.0,2863.0
61,879050749262655488,2017-06-25 18:56:45,This is Steven. He has trouble relating to other dogs. Quite shy. Neck longer than average. Tropical probably. 11/10 would still pet https://t.co/2mJCDEJWdD,11,10,Steven,0,0,0,0,21186.0,4296.0
62,879008229531029506,2017-06-25 16:07:47,This is Beau. That is Beau's balloon. He takes it everywhere. 13/10 would protect at all costs https://t.co/YDtpCjIPKN,13,10,Beau,0,0,0,0,17866.0,2458.0
63,878776093423087618,2017-06-25 00:45:22,This is Snoopy. He's a proud #PrideMonthPuppo. Impeccable handwriting for not having thumbs. 13/10 would love back #PrideMonth https://t.co/lNZwgNO4gS,13,10,Snoopy,0,0,0,1,18199.0,3744.0
64,878604707211726852,2017-06-24 13:24:20,Martha is stunning how h*ckin dare you. 13/10 https://t.co/9uABQXgjwa,13,10,,0,0,0,0,28349.0,6508.0
65,878281511006478336,2017-06-23 16:00:04,"Meet Shadow. In an attempt to reach maximum zooming borkdrive, he tore his ACL. Still 13/10 tho. Help him out below

https://t.co/245xJJElsY https://t.co/lUiQH219v6",13,10,Shadow,0,0,0,0,7272.0,1180.0
66,878057613040115712,2017-06-23 01:10:23,This is Emmy. She was adopted today. Massive round of pupplause for Emmy and her new family. 14/10 for all involved https://t.co/cwtWnHMVpe,14,10,Emmy,0,0,0,0,39606.0,6230.0
67,877736472329191424,2017-06-22 03:54:17,This is Aja. She was just told she's a good dog. Suspicions confirmed. 13/10 would tell again https://t.co/lsPyyAiF1r,13,10,Aja,0,0,0,0,74650.0,17372.0
68,877556246731214848,2017-06-21 15:58:08,This is Penny. She's both pupset and fired pup. Not pleased w your barbaric attempts at cleanliness. 12/10 would enjoy more shampoo options https://t.co/OYdDlfOGXP,12,10,Penny,0,0,0,0,21366.0,3494.0
69,877316821321428993,2017-06-21 00:06:44,"Meet Dante. At first he wasn't a fan of his new raincoat, then he saw his reflection. H*ckin handsome. 13/10 for water resistant good boy https://t.co/SHRTIo5pxc",13,10,Dante,0,0,0,0,25782.0,4772.0
70,877201837425926144,2017-06-20 16:29:50,This is Nelly. He graduated with his dogtorate today. Wants to know if you're proud of him. 12/10 would give congratulatory boop https://t.co/4g4cfj3P4Y,12,10,Nelly,0,0,0,0,25507.0,5121.0
71,876838120628539392,2017-06-19 16:24:33,This is Ginger. She's having a ruff Monday. Too many pupper things going on. H*ckin exhausting. 12/10 would snug passionately https://t.co/j211oCDRs6,12,10,Ginger,0,0,1,0,19480.0,3059.0
72,876537666061221889,2017-06-18 20:30:39,I can say with the pupmost confidence that the doggos who assisted with this search are heroic as h*ck. 14/10 for all https://t.co/8yoc1CNTsu,14,10,,0,0,0,0,22268.0,4303.0
73,876484053909872640,2017-06-18 16:57:37,This is Benedict. He wants to thank you for this delightful urban walk. Hopes you know he loves you. 13/10 super duper good boy https://t.co/26BXueUgbs,13,10,Benedict,0,0,0,0,17668.0,2177.0
74,876120275196170240,2017-06-17 16:52:05,"Meet Venti, a seemingly caffeinated puppoccino. She was just informed the weekend would include walks, pats and scritches. 13/10 much excite https://t.co/ejExJFq3ek",13,10,Venti,0,0,0,0,26353.0,4291.0
75,875747767867523072,2017-06-16 16:11:53,"This is Goose. He's a womanizer. Cheeky as h*ck, but also deep. Tongue slip game on another level. 13/10 will steal your girl https://t.co/V2WlACRJCN",13,10,Goose,0,0,0,0,23706.0,3922.0
76,875144289856114688,2017-06-15 00:13:52,Meet Nugget and Hank. Nugget took Hank's bone. Hank is wondering if you would please return it to him. Both 13/10 would not intervene https://t.co/ogith9ejNj,13,10,Nugget,0,0,0,0,20641.0,4512.0
77,875097192612077568,2017-06-14 21:06:43,You'll get your package when that precious man is done appreciating the pups. 13/10 for everyone https://t.co/PFp4MghzBW,13,10,,0,0,0,0,25875.0,5591.0
78,875021211251597312,2017-06-14 16:04:48,Guys please stop sending pictures without any dogs in th- oh never mind hello excuse me sir. 12/10 stealthy as h*ck https://t.co/brCQoqc8AW,12,10,,0,0,0,0,24028.0,4341.0
79,874680097055178752,2017-06-13 17:29:20,Meet Cash. He hath acquired a stick. A very good stick tbh. 12/10 would pat head approvingly https://t.co/lZhtizkURD,12,10,Cash,0,0,0,0,26217.0,4262.0
80,874296783580663808,2017-06-12 16:06:11,This is Jed. He may be the fanciest pupper in the game right now. Knows it too. 13/10 would sign modeling contract https://t.co/0YplNnSMEm,13,10,Jed,0,0,1,0,24573.0,3780.0
81,874057562936811520,2017-06-12 00:15:36,"I can't believe this keeps happening. This, is a birb taking a bath. We only rate dogs. Please only send dogs. Thank you... 12/10 https://t.co/pwY9PQhtP2",12,10,,0,0,0,0,21439.0,3664.0
82,874012996292530176,2017-06-11 21:18:31,"This is Sebastian. He can't see all the colors of the rainbow, but he can see that this flag makes his human happy. 13/10 #PrideMonth puppo https://t.co/XBE0evJZ6V",13,10,Sebastian,0,0,0,1,32366.0,9447.0
83,873580283840344065,2017-06-10 16:39:04,"We usually don't rate Deck-bound Saskatoon Black Bears, but this one is h*ckin flawless. Sneaky tongue slip too. 13/10 would hug firmly https://t.co/mNuMH9400n",13,10,,0,0,0,0,22864.0,3624.0
84,873213775632977920,2017-06-09 16:22:42,"This is Sierra. She's one precious pupper. Absolute 12/10. Been in and out of ICU her whole life. Help Sierra below

https://t.co/Xp01EU3qyD https://t.co/V5lkvrGLdQ",12,10,Sierra,0,0,1,0,6770.0,1473.0
85,872967104147763200,2017-06-09 00:02:31,Here's a very large dog. He has a date later. Politely asked this water person to check if his breath is bad. 12/10 good to go doggo https://t.co/EMYIdoblMR,12,10,,1,0,0,0,25776.0,4997.0
86,872820683541237760,2017-06-08 14:20:41,"Here are my favorite #dogsatpollingstations 
Most voted for a more consistent walking schedule and to increase daily pats tenfold. All 13/10 https://t.co/17FVMl4VZ5",13,10,,0,0,0,0,13933.0,3434.0
87,872620804844003328,2017-06-08 01:06:27,This is Monkey. She's supporting owners everywhere with her fancy #PrideMonth bandana. 13/10 love is love is love... https://t.co/lUcpnZDPz9,13,10,Monkey,0,0,0,0,19579.0,3366.0
88,872486979161796608,2017-06-07 16:14:40,We. Only. Rate. Dogs. Do not send in other things like this fluffy floor shark clearly ready to attack. Get it together guys... 12/10 https://t.co/BZHiKx3FpQ,12,10,,0,0,0,0,38534.0,8347.0
89,872261713294495745,2017-06-07 01:19:32,This is Harry. His ears are activated one at a time. Incredibly rare to witness in person. Very special moment here. 13/10 blessed as h*ck https://t.co/ejHvGDfWoa,13,10,Harry,0,0,0,0,,
90,872122724285648897,2017-06-06 16:07:15,This is Kody. He's a baller. Wishes he was a little bit taller. Double dribbles often. Still 12/10 would happily get dunked on https://t.co/PKSpmiefwN,12,10,Kody,0,0,0,0,32463.0,7480.0
91,871879754684805121,2017-06-06 00:01:46,Say hello to Lassie. She's celebrating #PrideMonth by being a splendid mix of astute and adorable. Proudly supupporting her owner. 13/10 https://t.co/uK6PNyeh9w,13,10,Lassie,0,0,0,0,35566.0,10165.0
92,871762521631449091,2017-06-05 16:15:56,This is Rover. As part of pupper protocol he had to at least attempt to eat the plant. Confirmed not tasty. Needs peanut butter. 12/10 https://t.co/AiVljI6QCg,12,10,Rover,0,0,1,0,19148.0,3233.0
93,871515927908634625,2017-06-04 23:56:03,This is Napolean. He's a Raggedy East Nicaraguan Zoom Zoom. Runs on one leg. Built for deception. No eyes. Good with kids. 12/10 great doggo https://t.co/PR7B7w1rUw,12,10,Napolean,1,0,0,0,19103.0,3222.0
94,871102520638267392,2017-06-03 20:33:19,Never doubt a doggo 14/10 https://t.co/AbBLh2FZCH,14,10,,1,0,0,0,19824.0,5112.0
95,871032628920680449,2017-06-03 15:55:36,"This is Boomer. He's doing an advanced water takeoff. The opposite of Sully. Ears for control, mlem for style. 13/10 simply breathtaking https://t.co/noNpY2Laoo",13,10,Boomer,0,0,0,0,21549.0,3550.0
96,870804317367881728,2017-06-03 00:48:22,Real funny guys. Sending in a pic without a dog in it. Hilarious. We'll rate the rug tho because it's giving off a very good vibe. 11/10 https://t.co/GCD1JccCyi,11,10,,0,0,0,0,31892.0,5739.0
97,870656317836468226,2017-06-02 15:00:16,"This is Cody. He zoomed too aggressively and tore his ACL. Happens to the best of us. Still 13/10

Help Cody here: https://t.co/4hxnDOt1CV https://t.co/42ryYRQ2Q4",13,10,Cody,0,0,0,0,11725.0,2453.0
98,870374049280663552,2017-06-01 20:18:38,This is Zoey. She really likes the planet. Would hate to see willful ignorance and the denial of fairly elemental science destroy it. 13/10 https://t.co/T1xlgaPujm,13,10,Zoey,0,0,0,0,78674.0,24584.0
99,870308999962521604,2017-06-01 16:00:09,"This is Rumble, but he's not ready to. Would rather fall asleep in his bath bucket. 13/10 would attempt a boop without waking https://t.co/MVQCzrF1g9",13,10,Rumble,0,0,0,0,20787.0,3860.0
100,870063196459192321,2017-05-31 23:43:25,Meet Clifford. He's quite large. Also red. Good w kids. Somehow never steps on them. Massive poops very inconvenient. Still 14/10 would ride https://t.co/apVOyDgOju,14,10,Clifford,0,0,0,0,34670.0,7728.0
101,869772420881756160,2017-05-31 04:27:59,"This is Dewey (pronounced ""covfefe""). He's having a good walk. Arguably the best walk. 13/10 would snug softly https://t.co/HciEaJkC4D",13,10,Dewey,0,0,0,0,40379.0,9403.0
102,869702957897576449,2017-05-30 23:51:58,Meet Stanley. He likes road trips. Will shift for you. One ear more effective than other. 13/10 we don't leave until you buckle pup Stanley https://t.co/vmCu3PFCQq,13,10,Stanley,0,0,0,0,26830.0,5865.0
103,869596645499047938,2017-05-30 16:49:31,This is Scout. He just graduated. Officially a doggo now. Have fun with taxes and losing sight of your ambitions. 12/10 would throw cap for https://t.co/DsA2hwXAJo,12,10,Scout,1,0,0,0,15164.0,2907.0
104,869227993411051520,2017-05-29 16:24:37,This is Gizmo. His favorite thing is standing pupright like a hooman. Sneaky tongue slip status achieved. 13/10 would boop well https://t.co/IoR3n1fiiQ,13,10,Gizmo,0,0,0,0,19415.0,3521.0
105,868880397819494401,2017-05-28 17:23:24,This is Walter. He won't start hydrotherapy without his favorite floatie. 14/10 keep it pup Walter https://t.co/r28jFx9uyF,14,10,Walter,0,0,0,0,62203.0,13453.0
106,868622495443632128,2017-05-28 00:18:35,Here's a h*ckin peaceful boy. Unbothered by the comings and goings. 13/10 please reveal your wise ways https://t.co/yeaH8Ej5eM,13,10,,0,0,0,0,25398.0,4948.0
107,868552278524837888,2017-05-27 19:39:34,"Say hello to Cooper. His expression is the same wet or dry. Absolute 12/10 but Coop desperately requests your help

https://t.co/ZMTE4Mr69f https://t.co/7RyeXTYLNi",12,10,Cooper,0,0,0,0,9601.0,1938.0
108,867900495410671616,2017-05-26 00:29:37,"Unbelievable. We only rate dogs. Please don't send in non-canines like the ""I"" from Pixar's opening credits. Thank you... 12/10 https://t.co/JMhDNv5wXZ",12,10,,0,0,0,0,23044.0,3907.0
109,867774946302451713,2017-05-25 16:10:44,Meet Harold.  He's h*ckin cooperative. 13/10 good work Harold https://t.co/ZYg3NZGICa,13,10,Harold,0,0,0,0,32372.0,6874.0
110,867421006826221569,2017-05-24 16:44:18,This is Shikha. She just watched you drop a skittle on the ground and still eat it. Could not be less impressed. 12/10 superior puppo https://t.co/XZlZKd73go,12,10,Shikha,0,0,0,1,15331.0,2327.0
111,867051520902168576,2017-05-23 16:16:06,"Oh my this spooked me up. We only rate dogs, not happy ghosts. Please send dogs only. It's a very simple premise. Thank you... 13/10 https://t.co/M5Rz0R8SIQ",13,10,,0,0,0,0,30719.0,7379.0
112,866720684873056260,2017-05-22 18:21:28,He was providing for his family 13/10 how dare you https://t.co/Q8mVwWN3f4,13,10,,0,0,0,0,19115.0,4489.0
113,866686824827068416,2017-05-22 16:06:55,This is Lili. She can't believe you betrayed her with bath time. Never looking you in the eye again. 12/10 would puppologize profusely https://t.co/9b9J46E86Z,12,10,Lili,0,0,0,0,18401.0,3273.0
114,866450705531457537,2017-05-22 00:28:40,"This is Jamesy. He gives a kiss to every other pupper he sees on his walk. 13/10 such passion, much tender https://t.co/wk7TfysWHr",13,10,Jamesy,0,0,1,0,116626.0,33030.0
115,866334964761202691,2017-05-21 16:48:45,This is Coco. At first I thought she was a cloud but clouds don't bork with such passion. 12/10 would hug softly https://t.co/W86h5dgR6c,12,10,Coco,0,0,0,0,50041.0,13371.0
116,865718153858494464,2017-05-19 23:57:46,"Meet Boomer. He's just checking pup on you. Hopes you had a good day. If not, he hopes he made it better. 13/10 extremely good boy https://t.co/pozUoHLkGg",13,10,Boomer,0,0,0,0,24498.0,5278.0
117,865359393868664832,2017-05-19 00:12:11,This is Sammy. Her tongue ejects without warning sometimes. It's a serious condition. Needs a hefty dose from a BlepiPen. 13/10 https://t.co/g20EmqK7vc,13,10,Sammy,0,0,0,0,25300.0,4705.0
