,tweet_id,timestamp,text,rating_numerator,rating_denominator,name,doggo,floofer,pupper,puppo,favorite_count,retweet_count
487,790987426131050500,2016-10-25 18:44:32,This is Misty. She has a cowboy hat on her nose. 12/10 https://t.co/Eno0mypHIr,12,10,Misty,0,0,0,0,10051.0,2186.0
488,790946055508652032,2016-10-25 16:00:09,This is Betty. She's assisting with the dishes. Such a good puppo. 12/10 h*ckin helpful af https://t.co/dgvTPZ9tgI,12,10,Betty,0,0,0,1,17006.0,4800.0
489,790698755171364864,2016-10-24 23:37:28,This is Mosby. He appears to be rather h*ckin snuggable af. 12/10 keep it up Mosby https://t.co/IiiBq460I7,12,10,Mosby,0,0,0,0,8406.0,1974.0
490,790581949425475584,2016-10-24 15:53:19,This is Duke. He sneaks into the fridge sometimes. It's his safe place. 11/10 would give little jacket if necessary https://t.co/Fd5WFDTMH4,11,10,Duke,0,0,0,0,21092.0,7342.0
491,790337589677002753,2016-10-23 23:42:19,Meet Maggie. She can hear your cells divide. 12/10 can also probably fly https://t.co/ovE2hqXryV,12,10,Maggie,0,0,0,0,8000.0,1926.0
492,790277117346975746,2016-10-23 19:42:02,This is Bruce. He never backs down from a challenge. 11/10 you got this Bruce https://t.co/aI7umZHIq7,11,10,Bruce,0,0,0,0,12829.0,3251.0
493,789986466051088384,2016-10-23 00:27:05,This is Happy. He's a bathtub reviewer. Seems to be pleased with this one. 12/10 https://t.co/Ln89R4FP7v,12,10,Happy,0,0,0,0,9461.0,2371.0
494,789903600034189313,2016-10-22 18:57:48,This is Ralphy. His dreams were just shattered. Poor pupper. 13/10 it'll be ok Ralphy https://t.co/P0kSN6rT6H,13,10,Ralphy,0,0,1,0,10579.0,4229.0
495,789628658055020548,2016-10-22 00:45:17,This is Eli. He can fly. 13/10 magical af https://t.co/huPSJJ7FDI,13,10,Eli,0,0,0,0,7653.0,1819.0
496,789599242079838210,2016-10-21 22:48:24,This is Brownie. She's wearing a Halloween themed onesie. 12/10 festive af https://t.co/0R4meWXFOx,12,10,Brownie,0,0,0,0,6903.0,1973.0
497,789530877013393408,2016-10-21 18:16:44,This is Rizzy. She smiles a lot. 12/10 contagious af https://t.co/TU4sZogVIq,12,10,Rizzy,0,0,0,0,11984.0,3462.0
498,789314372632018944,2016-10-21 03:56:25,"HE WAS JUST A LIL SLEEPY FROM BEING SUCH A GOOD DOGGI ALL THE TIME MISTAKES HAPPEN 13/10
https://t.co/G2ms0A5jWM",13,10,,0,0,0,0,8831.0,2351.0
499,789137962068021249,2016-10-20 16:15:26,This is Bo. He's a West Congolese Bugaboop Snuggle. Rather exotic. Master of the head tilt. 12/10 would pay to pet https://t.co/2jwxxtNzoN,12,10,Bo,0,0,0,0,9924.0,2866.0
500,788908386943430656,2016-10-20 01:03:11,"This is Lucy. She destroyed not one, but two remotes trying to turn off the debate. 11/10 relatable af https://t.co/3BXh073tDm",11,10,Lucy,0,0,0,0,28011.0,12761.0
501,788765914992902144,2016-10-19 15:37:03,This is Butter. She can have whatever she wants forever. 12/10 would hug softly https://t.co/x5gXRS1abq,12,10,Butter,0,0,0,0,27930.0,10574.0
502,788412144018661376,2016-10-18 16:11:17,This is Dexter. He breaks hearts for a living. 11/10 h*ckin handsome af https://t.co/4DhSsC1W7S,11,10,Dexter,0,0,0,0,15878.0,5399.0
503,788178268662984705,2016-10-18 00:41:57,Atlas is back and this time he's got doggles. Still 13/10 solarly conscious af https://t.co/s7MgFWDySc,13,10,,0,0,0,0,7375.0,2144.0
504,788150585577050112,2016-10-17 22:51:57,This is Leo. He's a golden chow. Rather h*ckin rare. 13/10 would give extra pats https://t.co/xosHjFzVXc,13,10,Leo,0,0,0,0,6253.0,1318.0
505,788039637453406209,2016-10-17 15:31:05,Did... did they pick out that license plate? 12/10 for both https://t.co/lRmUUOxgbQ,12,10,,0,0,0,0,6255.0,1352.0
506,787810552592695296,2016-10-17 00:20:47,This is Frank. He wears sunglasses and walks himself. 11/10 I'll never be this cool or independent https://t.co/pNNjBtHWPc,11,10,Frank,0,0,0,0,8815.0,3130.0
507,787717603741622272,2016-10-16 18:11:26,This is Tonks. She is a service puppo. Can hear a caterpillar hiccup from 7 miles away. 13/10 would follow anywhere https://t.co/i622ZbWkUp,13,10,Tonks,0,0,0,1,10473.0,2849.0
508,787397959788929025,2016-10-15 21:01:17,This is Moose. He's rather h*ckin dangerous (you can tell by the collar). 11/10 would still attempt to snug https://t.co/lHVHGdDzb3,11,10,Moose,0,0,0,0,11109.0,2906.0
509,786963064373534720,2016-10-14 16:13:10,This is Rory. He's got an interview in a few minutes. Looking spiffy af. Nervous as h*ck tho. 12/10 would hire https://t.co/ibj5g6xaAj,12,10,Rory,0,0,0,0,27165.0,8157.0
510,786709082849828864,2016-10-13 23:23:56,"This is Logan, the Chow who lived. He solemnly swears he's up to lots of good. H*ckin magical af 9.75/10 https://t.co/yBO5wuqaPS",75,10,Logan,0,0,0,0,18622.0,6249.0
511,786664955043049472,2016-10-13 20:28:35,"""Honestly Kathleen I just want more Ken Bone"" 12/10 https://t.co/HmlEvAMP4r",12,10,,0,0,0,0,10825.0,2615.0
512,786595970293370880,2016-10-13 15:54:28,This is Dale. He's a real spookster. Did me quite the frighten. 11/10 not too spooky to pet tho https://t.co/L8BWDD4oBX,11,10,Dale,0,0,0,0,9621.0,3182.0
513,786363235746385920,2016-10-13 00:29:39,This is Rizzo. He has many talents. A true renaissance doggo. 13/10 entertaining af https://t.co/TVXpEJB7Wn,13,10,Rizzo,1,0,0,0,11113.0,3591.0
514,786286427768250368,2016-10-12 19:24:27,This is Arnie. He's afraid of his own bark. 12/10 would comfort https://t.co/ObT2tSxXit,12,10,Arnie,0,0,0,0,8134.0,2911.0
515,786233965241827333,2016-10-12 15:55:59,This is Mattie. She's extremely dangerous. Will bite your h*ckin finger right off. Still 11/10 would pet with caution https://t.co/78c9W8kLFh,11,10,Mattie,0,0,0,0,15574.0,4856.0
516,785927819176054784,2016-10-11 19:39:28,This is Lucy. She's strives to be the best potato she can be. 12/10 would boop https://t.co/lntsj7Fc4Y,12,10,Lucy,0,0,0,0,11628.0,3254.0
517,785872687017132033,2016-10-11 16:00:24,Meet Rusty. He appears to be rather h*ckin fluffy. Also downright adorable af. 12/10 would rub my face against his https://t.co/1j9kLGb4wV,12,10,Rusty,0,0,0,0,6828.0,1859.0
518,785533386513321988,2016-10-10 17:32:08,This is Dallas. Her tongue is ridiculous. 11/10 h*ckin proud af https://t.co/h4jhlH4EyG,11,10,Dallas,0,0,0,0,9294.0,2037.0
519,785264754247995392,2016-10-09 23:44:41,This is Doc. He requested to be carried around like that. 12/10 anything for Doc https://t.co/mWYACm4qnx,12,10,Doc,0,0,0,0,7401.0,1676.0
520,785170936622350336,2016-10-09 17:31:53,This is Hero. He was enjoying the car ride until he remembered that bees are dying globally at an alarming rate. 11/10 https://t.co/cubFg7F4qQ,11,10,Hero,0,0,0,0,12282.0,4938.0
521,784826020293709826,2016-10-08 18:41:19,This is Rusty. He's going D1 for sure. Insane vertical. 13/10 would draft https://t.co/AsykOwMrXQ,13,10,Rusty,0,0,0,0,10320.0,3314.0
522,784517518371221505,2016-10-07 22:15:26,This is Frankie. He has yet to learn how to control his tongue. 11/10 maybe one day https://t.co/p6fgYe2dB6,11,10,Frankie,0,0,0,0,9149.0,2591.0
523,784431430411685888,2016-10-07 16:33:21,This is Stormy. He's curly af. Already pupared for Coachella next year. 12/10 https://t.co/PHA1vtqqpt,12,10,Stormy,0,0,0,0,5809.0,1296.0
524,784183165795655680,2016-10-07 00:06:50,This is Reginald. He's one magical puppo. Aerodynamic af. 12/10 would catch https://t.co/t0cEeRbcXJ,12,10,Reginald,0,0,0,1,20483.0,8237.0
525,784057939640352768,2016-10-06 15:49:14,This is Balto. He's very content. Legendary tongue slippage. 12/10 would pet forever https://t.co/T7Jr4Gw4sC,12,10,Balto,0,0,0,0,30352.0,11361.0
526,783839966405230592,2016-10-06 01:23:05,This is Riley. His owner put a donut pillow around him and he loves it so much he won't let anyone take it off. 13/10 https://t.co/8TCQcsZCZ8,13,10,Riley,0,0,0,0,30600.0,11004.0
527,783821107061198850,2016-10-06 00:08:09,This is Mairi. She has mastered the art of camouflage. 12/10 h*ckin sneaky af https://t.co/STcPjiNAHp,12,10,Mairi,0,0,0,0,7496.0,2013.0
528,783695101801398276,2016-10-05 15:47:27,This is Loomis. He's the leader of the Kenneth search party. The passion is almost overwhelming. 12/10 one day he will be free https://t.co/kCRKlFg4AY,12,10,Loomis,0,0,0,0,10663.0,3281.0
529,783466772167098368,2016-10-05 00:40:09,This is Finn. He likes eavesdropping from filing cabinets. It's a real issue but no one has approached him about it. 11/10 would still pet https://t.co/s8W8Del9HQ,11,10,Finn,0,0,0,0,8618.0,2291.0
530,783391753726550016,2016-10-04 19:42:03,Meet Godi. He's an avid beachgoer and part time rainbow summoner. Eyeliner flawless af. 13/10 would snug well https://t.co/BO936YdJdi,13,10,Godi,0,0,0,0,17191.0,5602.0
531,783334639985389568,2016-10-04 15:55:06,This is Dave. He's currently in a predicament. Doesn't seem to mind tho. 12/10 someone assist Dave https://t.co/nfprKAXqwu,12,10,Dave,0,0,0,0,29706.0,11921.0
532,783085703974514689,2016-10-03 23:25:55,This is Earl. He can't catch. Did his best tho. 11/10 would repair confidence with extra pats https://t.co/IsqyvbjFgM,11,10,Earl,0,0,0,0,8308.0,2242.0
533,782969140009107456,2016-10-03 15:42:44,This is Cali. She arrived preassembled. Convenient af. 12/10 appears to be rather h*ckin pettable https://t.co/vOBV1ZqVcX,12,10,Cali,0,0,0,0,24565.0,7525.0
534,782747134529531904,2016-10-03 01:00:34,This is Deacon. He's the happiest almost dry doggo I've ever seen. 11/10 would smile back https://t.co/C6fUMnHt1H,11,10,Deacon,1,0,0,0,7618.0,1438.0
535,782598640137187329,2016-10-02 15:10:30,This is Timmy. He's quite large. According to a trusted source it's actually a dog wearing a dog suit. 11/10 https://t.co/BIUchFwHqn,11,10,Timmy,0,0,0,0,7946.0,1911.0
536,782305867769217024,2016-10-01 19:47:08,This is Sampson. He just graduated. Ready to be a doggo now. Time for the real world. 12/10 have fun with taxes https://t.co/pgVKxRw0s1,12,10,Sampson,1,0,0,0,16966.0,5690.0
537,781955203444699136,2016-09-30 20:33:43,This is Chipson. He weighed in at .3 ounces and is officially super h*ckin smol. Space-saving af. 11/10 would snug delicately https://t.co/FjEsk7A1JV,11,10,Chipson,0,0,0,0,11329.0,3442.0
538,781655249211752448,2016-09-30 00:41:48,This is Combo. The daily struggles of being a doggo have finally caught up with him. 11/10 https://t.co/LOKrNo0OM7,11,10,Combo,1,0,0,0,4064.0,1146.0
539,781524693396357120,2016-09-29 16:03:01,Idk why this keeps happening. We only rate dogs. Not Bangladeshi Couch Chipmunks. Please only send dogs... 12/10 https://t.co/ya7bviQUUf,12,10,,0,0,0,0,21104.0,5670.0
540,781308096455073793,2016-09-29 01:42:20,"Pupper butt 1, Doggo 0. Both 12/10 https://t.co/WQvcPEpH2u",12,10,,1,0,1,0,7273.0,2596.0
541,781251288990355457,2016-09-28 21:56:36,This is Oakley. He just got yelled at for going 46 in a 45. Churlish af. 11/10 would still pet so well https://t.co/xIYsa6LPA4,11,10,Oakley,0,0,0,0,8574.0,2119.0
542,780931614150983680,2016-09-28 00:46:20,I want to finally rate this iconic puppo who thinks the parade is all for him. 13/10 would absolutely attend https://t.co/5dUYOu4b8d,13,10,,0,0,0,1,22017.0,7454.0
543,780800785462489090,2016-09-27 16:06:28,This is Koda. He has a weird relationship with tall grass. Slightly concerning. 11/10 would def still pet https://t.co/KQzSR8eCsw,11,10,Koda,0,0,0,0,5588.0,1326.0
544,780601303617732608,2016-09-27 02:53:48,Meet Hercules. He can have whatever he wants for the rest of eternity. 12/10 would snug passionately https://t.co/mH0IOyFdIG,12,10,Hercules,0,0,0,0,12322.0,3406.0
545,780543529827336192,2016-09-26 23:04:13,Here's a perturbed super floof. 12/10 would snug so damn well https://t.co/VG095mi09Q,12,10,,0,0,0,0,6418.0,1773.0
546,780459368902959104,2016-09-26 17:29:48,"This is Bear. Don't worry, he's not a real bear tho. Contains unreal amounts of squish. 11/10 heteroskedastic af https://t.co/coi4l1T2Sm",11,10,Bear,0,0,0,0,5382.0,1098.0
547,780192070812196864,2016-09-25 23:47:39,We only rate dogs. Pls stop sending in non-canines like this Urban Floof Giraffe. I can't handle this. 11/10 https://t.co/zHIqpM5Gni,11,10,,0,0,0,0,8856.0,2290.0
548,779834332596887552,2016-09-25 00:06:08,This is Scout. He really wants to kiss himself. H*ckin inappropriate. 11/10 narcissistic af https://t.co/x0gV2Ck3AD,11,10,Scout,0,0,0,0,19221.0,7181.0
549,779377524342161408,2016-09-23 17:50:56,Have you ever seen such a smol pupper? Portable af. 12/10 would keep in shirt pocket https://t.co/KsqaIzlQ12,12,10,,0,0,1,0,8958.0,3170.0
550,779123168116150273,2016-09-23 01:00:13,This is Reggie. He hugs everyone he meets. 12/10 keep spreading the love Reggie https://t.co/uMfhduaate,12,10,Reggie,0,0,0,0,,
551,779056095788752897,2016-09-22 20:33:42,Everybody drop what you're doing and look at this dog. 13/10 must be super h*ckin rare https://t.co/I1bJUzUEW5,13,10,,0,0,0,0,15021.0,4607.0
552,778990705243029504,2016-09-22 16:13:51,This is Jay. He's really h*ckin happy about the start of fall. Sneaky tongue slip in 2nd pic. 11/10 snuggly af https://t.co/vyx1X5eyWI,11,10,Jay,0,0,0,0,20309.0,7347.0
553,778764940568104960,2016-09-22 01:16:45,"Oh my god it's Narcos but Barkos. 13/10 someone please make this happen
https://t.co/tird9cIlzB",13,10,,0,0,0,0,882.0,367.0
554,778748913645780993,2016-09-22 00:13:04,"This is Mya (pronounced ""mmmyah?""). Her head is round af. 11/10 would pat accordingly https://t.co/1dpEuALnY0",11,10,Mya,0,0,0,0,7008.0,1338.0
555,778624900596654080,2016-09-21 16:00:17,This is Penny. She's a sailor pup. 11/10 would take to the open seas with https://t.co/0rRxyBQt32,11,10,Penny,0,0,0,0,4715.0,1027.0
556,778408200802557953,2016-09-21 01:39:11,RIP Loki. Thank you for the good times. You will be missed by many. 14/10 https://t.co/gJKD9pst5A,14,10,,0,0,0,0,13834.0,4411.0
557,778383385161035776,2016-09-21 00:00:35,This is Nala. She's a future Dogue model. Won't respond to my texts. 13/10 would be an honor to pet https://t.co/zP1IvAATWv,13,10,Nala,0,0,0,0,5930.0,1122.0
558,778286810187399168,2016-09-20 17:36:50,This is Stanley. He has too much skin. Isn't happy about it. Quite pupset actually. Still 11/10 would comfort https://t.co/hhTfnPrWfb,11,10,Stanley,0,0,0,0,10550.0,3355.0
559,778039087836069888,2016-09-20 01:12:28,Evolution of a pupper yawn featuring Max. 12/10 groundbreaking stuff https://t.co/t8Y4x9DmVD,12,10,,0,0,1,0,8637.0,2688.0
560,778027034220126208,2016-09-20 00:24:34,This is Sophie. She's a Jubilant Bush Pupper. Super h*ckin rare. Appears at random just to smile at the locals. 11.27/10 would smile back https://t.co/QFaUiIHxHq,27,10,Sophie,0,0,1,0,6655.0,1643.0
561,777684233540206592,2016-09-19 01:42:24,"""Yep... just as I suspected. You're not flossing."" 12/10 and 11/10 for the pup not flossing https://t.co/SuXcI9B7pQ",12,10,,0,0,0,0,11414.0,2984.0
562,777621514455814149,2016-09-18 21:33:11,This is Derek. You can't look at him and not smile. Must've just had a blue pupsicle. 12/10 would snug intensely https://t.co/BnVTMtUeI3,12,10,Derek,0,0,0,0,8897.0,2543.0
563,777189768882946048,2016-09-17 16:57:35,This is Jeffrey. He's being held so he doesn't fly away. 12/10 would set free https://t.co/d3aLyCykn7,12,10,Jeffrey,0,0,0,0,14498.0,4373.0
564,776813020089548800,2016-09-16 16:00:31,Meet Solomon. He was arrested for possession of adorable and attempted extra pats on the head. 12/10 would post bail https://t.co/nFqLaOLUQA,12,10,Solomon,0,0,0,0,4949.0,1231.0
565,776477788987613185,2016-09-15 17:48:25,This is Huck. He's addicted to caffeine. Hope it's not too latte to seek help. 11/10 stay strong pupper https://t.co/iJE3F0VozW,11,10,Huck,0,0,1,0,8967.0,2830.0
566,776218204058357768,2016-09-15 00:36:55,Atlas rolled around in some chalk and now he's a magical rainbow floofer. 13/10 please never take a bath https://t.co/nzqTNw0744,13,10,,0,1,0,0,30372.0,16125.0
567,776113305656188928,2016-09-14 17:40:06,This is Sampson. He's about to get hit with a vicious draw 2. Has no idea. 11/10 poor pupper https://t.co/FYT9QBEnKG,11,10,Sampson,0,0,1,0,11950.0,4422.0
568,775842724423557120,2016-09-13 23:44:54,This is Blue. He was having an average day until his owner told him about Bront. 12/10 h*ckin hysterical af https://t.co/saRYTcxQeH,12,10,Blue,0,0,0,0,11897.0,2696.0
569,775733305207554048,2016-09-13 16:30:07,This is Anakin. He strives to reach his full doggo potential. Born with blurry tail tho. 11/10 would still pet well https://t.co/9CcBSxCXXG,11,10,Anakin,1,0,0,0,14063.0,4049.0
570,775729183532220416,2016-09-13 16:13:44,This girl straight up rejected a guy because he doesn't like dogs. She is my hero and I give her 13/10 https://t.co/J39lT3b0rH,13,10,,0,0,0,0,13172.0,4662.0
571,775364825476165632,2016-09-12 16:05:54,This is Finley. He's an independent doggo still adjusting to life on his own. 11/10 https://t.co/7FNcBaKbci,11,10,Finley,1,0,0,0,7508.0,3018.0
572,775350846108426240,2016-09-12 15:10:21,This is Maximus. A little rain won't stop him. He will persevere. 12/10 innovative af  https://t.co/2OmDMAkkou,12,10,Maximus,0,0,0,0,10320.0,3962.0
573,775085132600442880,2016-09-11 21:34:30,This is Tucker. He would like a hug. 13/10 someone hug him https://t.co/wdgY9oHPrT,13,10,Tucker,0,0,0,0,15786.0,4811.0
574,774757898236878852,2016-09-10 23:54:11,This is Finley. She's a Beneboop Cumbersplash. 12/10 I'd do unspeakable things for Finley https://t.co/dS8SCbNF9P,12,10,Finley,0,0,0,0,8728.0,1817.0
575,774314403806253056,2016-09-09 18:31:54,I WAS SENT THE ACTUAL DOG IN THE PROFILE PIC BY HIS OWNER THIS IS SO WILD. 14/10 ULTIMATE LEGEND STATUS https://t.co/7oQ1wpfxIH,14,10,,0,0,0,0,22088.0,5614.0
576,773985732834758656,2016-09-08 20:45:53,Meet Winnie. She just made awkward eye contact with the driver beside her. Poor pupper panicked. 11/10 would comfort https://t.co/RFWtDqTnAz,11,10,Winnie,0,0,1,0,10885.0,3933.0
577,773922284943896577,2016-09-08 16:33:46,"This is Heinrich (pronounced ""Pat""). He's a Botswanian Vanderfloof. Snazzy af bandana. 12/10 downright puptacular https://t.co/G56ikYAqFg",12,10,Heinrich,0,0,0,0,6484.0,1772.0
578,773704687002451968,2016-09-08 02:09:06,This is Loki. He knows he's adorable. One ear always pupared. 12/10 would snug in depicted fashion forever https://t.co/OqNggd4Oio,12,10,Loki,0,0,0,0,6692.0,1650.0
579,773547596996571136,2016-09-07 15:44:53,This is Chelsea. She forgot how to dog. 11/10 get it together pupper https://t.co/nBJ5RE4yHb,11,10,Chelsea,0,0,1,0,22428.0,6266.0
580,773308824254029826,2016-09-06 23:56:05,This is Bungalo. She uses that face to get what she wants. It works unbelievably well. 12/10 would never say no to https://t.co/0Fcft7jl4N,12,10,Bungalo,0,0,0,0,23629.0,7580.0
581,773191612633579521,2016-09-06 16:10:20,This is Grey. He's the dogtor in charge of your checkpup today. 12/10 I'd never miss an appointment https://t.co/9HEVPJEioD,12,10,Grey,0,0,0,0,10124.0,4204.0
582,772877495989305348,2016-09-05 19:22:09,You need to watch these two doggos argue through a cat door. Both 11/10 https://t.co/qEP31epKEV,11,10,,0,0,0,0,8685.0,3938.0
583,772826264096874500,2016-09-05 15:58:34,"Meet Roosevelt. He's preparing for takeoff. Make sure tray tables are in their full pupright &amp; licked position
11/10 https://t.co/7CQkn3gHOQ",11,10,Roosevelt,0,0,0,0,8167.0,2383.0
584,772193107915964416,2016-09-03 22:02:38,This is Willem. He's a Penn State pupper. Thinks the hood makes him more intimidating. It doesn't. 12/10 https://t.co/Dp0s7MRIHK,12,10,Willem,0,0,1,0,6122.0,1410.0
585,772117678702071809,2016-09-03 17:02:54,Meet Jack. He's a Clemson pup. Appears to be rather h*ckin pettable. Almost makes me want to root for Clemson. 12/10 https://t.co/GHOfbTVQti,12,10,Jack,0,0,0,0,3825.0,751.0
586,772102971039580160,2016-09-03 16:04:27,This is Penny. She's an OU cheerleader. About to do a triple back handspring down the stairs. 11/10 hype af https://t.co/B2f3XkGU5c,11,10,Penny,0,0,0,0,4052.0,953.0
587,771908950375665664,2016-09-03 03:13:29,"Doggo will persevere. 13/10
https://t.co/yOVzAomJ6k",13,10,,1,0,0,0,6675.0,1932.0
588,771770456517009408,2016-09-02 18:03:10,This is Davey. He'll have your daughter home by 8. Just a stand up pup. 11/10 would introduce to mom https://t.co/E6bGWf9EOm,11,10,Davey,0,0,0,0,12158.0,3434.0
589,771500966810099713,2016-09-02 00:12:18,This is Dakota. He's just saying hi. That's all. 12/10 someone wave back https://t.co/1tWe5zZoHv,12,10,Dakota,0,0,0,0,8362.0,2644.0
590,771380798096281600,2016-09-01 16:14:48,Meet Fizz. She thinks love is a social construct consisting solely of ideals perpetuated by mass media 11/10 woke af https://t.co/sPB5JMnWBn,11,10,Fizz,0,0,0,0,10623.0,5162.0
591,771136648247640064,2016-09-01 00:04:38,This is Dixie. She wants to be a ship captain. Won't let anything get in between her and her dreams. 11/10 https://t.co/8VEDZKHddR,11,10,Dixie,0,0,0,0,9270.0,2971.0
592,771102124360998913,2016-08-31 21:47:27,This is Charlie. He works for @TODAYshow. Super sneaky tongue slip here. 12/10 would pet until someone made me stop https://t.co/K5Jo7QRCvA,12,10,Charlie,0,0,0,0,6325.0,1459.0
593,770772759874076672,2016-08-30 23:58:40,This is Sebastian. He's super h*ckin fluffy. That's really all you need to know. 11/10 would snug intensely https://t.co/lqr0NdtwQo,11,10,Sebastian,0,0,0,0,5249.0,1433.0
594,770655142660169732,2016-08-30 16:11:18,We only rate dogs. Pls stop sending in non-canines like this Arctic Floof Kangaroo. This is very frustrating. 11/10 https://t.co/qlUDuPoE3d,11,10,,0,0,0,0,7428.0,1792.0
595,770414278348247044,2016-08-30 00:14:12,Meet Al Cabone. He's a gangsta puppa. Rather h*ckin ruthless. Shows no mercy sometimes. 11/10 pet w extreme caution https://t.co/OUwWbEKOUV,11,10,Al,0,0,0,0,6390.0,2127.0
596,769940425801170949,2016-08-28 16:51:16,This is Klein. These pics were taken a month apart. He knows he's a stud now. 12/10 total heartthrob https://t.co/guDkLrX8zV,12,10,Klein,0,0,0,0,31756.0,9695.0
597,769695466921623552,2016-08-28 00:37:54,This is Titan. He's trying to make friends. Offering up his favorite stick. 13/10 philanthropic af https://t.co/vhrkz0dK4v,13,10,Titan,0,0,0,0,6485.0,1696.0
598,769212283578875904,2016-08-26 16:37:54,This is DonDon. He's way up but doesn't feel blessed. Rather uncomfortable actually. 12/10 I'll save you DonDon https://t.co/OCYLz3fjVE,12,10,DonDon,0,0,0,0,5467.0,1748.0
599,768970937022709760,2016-08-26 00:38:52,This is Kirby. His bowl weighs more than him. 12/10 would assist https://t.co/UlB2mzw3Xs,12,10,Kirby,0,0,0,0,14547.0,6598.0
600,768855141948723200,2016-08-25 16:58:45,This is Jesse. He really wants a belly rub. Will be as cute as possible to achieve that goal. 11/10 https://t.co/1BxxcdVNJ8,11,10,Jesse,0,0,0,0,4249.0,900.0
601,768596291618299904,2016-08-24 23:50:10,Say hello to Oakley and Charlie. They're convinced that they each have their own stick. Nobody tell them. Both 12/10 https://t.co/J2AJdyxglH,12,10,Oakley,0,0,0,0,5093.0,1297.0
602,768473857036525572,2016-08-24 15:43:39,Meet Chevy. He had a late breakfast and now has to choose between a late lunch or an early dinner. 11/10 very pupset https://t.co/goy9053wC7,11,10,Chevy,0,0,0,0,13781.0,3476.0
603,767754930266464257,2016-08-22 16:06:54,This is Philbert. His toilet broke and he doesn't know what to do. Trying not to panic. 11/10 furustrated af https://t.co/Nb68IsVb9O,11,10,Philbert,0,0,0,0,16185.0,5457.0
604,767500508068192258,2016-08-21 23:15:55,This is Louie. He's making quite a h*ckin mess. Doesn't seem to care. 12/10 jubilant af https://t.co/Z2g2YWPzX2,12,10,Louie,0,0,0,0,7587.0,2369.0
605,767191397493538821,2016-08-21 02:47:37,I don't know any of the backstory behind this picture but for some reason I'm crying. 13/10 for owner and doggo https://t.co/QOKZdus9TT,13,10,,1,0,0,0,12435.0,3812.0
606,767122157629476866,2016-08-20 22:12:29,This is Rupert. You betrayed him with bath time but he forgives you. Cuddly af 13/10 https://t.co/IEARC2sRzC,13,10,Rupert,0,0,0,0,10285.0,2892.0
607,766693177336135680,2016-08-19 17:47:52,This is Brudge. He's a Doberdog. Going to be h*ckin massive one day. 11/10 would pat on head approvingly https://t.co/cTlHjEUNK8,11,10,Brudge,0,0,0,0,4059.0,808.0
608,766313316352462849,2016-08-18 16:38:26,This is Oscar. He has legendary eyebrows and he h*ckin knows it. Curly af too. 12/10 would hug passionately https://t.co/xuxZoObmF0,12,10,Oscar,0,0,0,0,6856.0,1911.0
609,766069199026450432,2016-08-18 00:28:24,This is Juno. She can see your future. 12/10 h*ckin mesmerizing af https://t.co/Z69mShifuk,12,10,Juno,0,0,0,0,4272.0,863.0
610,766008592277377025,2016-08-17 20:27:34,This is Angel. She stole the @ShopWeRateDogs shirt from her owner. Fits pretty well actually. 11/10 would forgive https://t.co/jaivZ1dcUL,11,10,Angel,0,0,0,0,3781.0,502.0
611,765719909049503744,2016-08-17 01:20:27,This is Brat. He has a hard time being ferocious so his owner helps out. H*ckin scary af now. 12/10 would still pet https://t.co/soxdNqZDZ2,12,10,Brat,0,0,0,0,7300.0,2170.0
612,765669560888528897,2016-08-16 22:00:23,This is Tove. She's a Balsamic Poinsetter. Surprisingly deadly. 12/10 snug with caution https://t.co/t6RvnVEdRR,12,10,Tove,0,0,0,0,5239.0,1240.0
613,765395769549590528,2016-08-16 03:52:26,This is my dog. Her name is Zoey. She knows I've been rating other dogs. She's not happy. 13/10 no bias at all https://t.co/ep1NkYoiwB,13,10,,0,0,0,0,26863.0,3413.0
614,765371061932261376,2016-08-16 02:14:15,This is Louie. He's had a long day. Did a lot of pupper things. Also appears to be rather heckin pettable. 11/10 https://t.co/w2qDmoTIZ5,11,10,Louie,0,0,1,0,7144.0,2190.0
615,764857477905154048,2016-08-14 16:13:27,This is Aubie. He has paws for days. Nibbling tables is one of his priorities. Second only to being cuddly af. 12/10 https://t.co/cBIFBsCRz6,12,10,Aubie,0,0,0,0,6514.0,1794.0
616,763837565564780549,2016-08-11 20:40:41,This is Alfie. He's touching a butt. Couldn't be happier. 11/10 https://t.co/gx3xF5mZbo,11,10,Alfie,0,0,0,0,12730.0,4199.0
617,762699858130116608,2016-08-08 17:19:51,This is Leela. She's a Fetty Woof. Lost eye while saving a baby from an avalanche. 11/10 true h*ckin hero https://t.co/2lBg3ZgivD,11,10,Leela,0,0,0,0,12257.0,3656.0
618,762471784394268675,2016-08-08 02:13:34,Meet Glenn. Being in public scares him. Frighteningly relatable. 12/10 keep hangin in there Glenn (Imgur - Wuhahha) https://t.co/pA4MDKwRci,12,10,Glenn,0,0,0,0,11316.0,6487.0
